title,category,content
Morbi efficitur maximus elit.,cat 3,"Pellentesque tempus sit amet augue suscipit aliquam. Morbi et aliquet lacus, sit amet ultricies tortor. Integer maximus nunc at quam consectetur convallis. Mauris interdum, urna nec pellentesque lobortis, neque dui scelerisque felis, ac ultricies nibh lectus non velit. Nunc vitae volutpat dolor. Praesent rhoncus gravida ipsum, in bibendum lorem auctor ac. Curabitur eu cursus justo. Aenean dapibus nulla id vestibulum fermentum. Nam non nunc euismod risus mattis condimentum. Ut quis arcu sit amet lorem mattis vestibulum."
Nulla semper suscipit semper.,cat 1.2.1,"Aliquam lobortis, arcu ac efficitur bibendum, libero nunc condimentum orci, in viverra ipsum nibh quis dolor. Vestibulum pretium orci quis arcu facilisis volutpat. Ut et ex convallis, dapibus arcu quis, iaculis nulla. Nulla tincidunt tortor felis, quis vestibulum purus malesuada nec. Nunc sagittis rutrum mi, pharetra fringilla risus imperdiet vitae. Quisque interdum tellus sapien, vel scelerisque ipsum fringilla ac. Sed ac mi imperdiet, congue metus ac, pretium neque."
Etiam condimentum hendrerit tortor.,cat 1.2.2,"Nullam pulvinar ipsum id enim porta ultricies eu ac velit. Suspendisse ultrices libero eu libero suscipit, ut commodo nisl ullamcorper. Quisque commodo tristique augue quis mattis. Donec tempus, purus dignissim facilisis venenatis, arcu neque bibendum quam, a scelerisque turpis velit a nisl. Vivamus quis gravida dui. Morbi vitae orci condimentum, scelerisque elit et, fermentum turpis. Aliquam et semper leo. Nunc quis odio at velit maximus vestibulum ac sit amet odio. Phasellus sem felis, malesuada vel lacinia id, imperdiet ut elit."
"Donec pellentesque, felis in.",cat 1.2,"Duis sit amet dui cursus, elementum mi bibendum, molestie mauris. Etiam non neque vehicula, congue neque eget, tempus massa. Integer vulputate lectus ut massa auctor suscipit. Duis at nunc tortor. Interdum et malesuada fames ac ante ipsum primis in faucibus. Phasellus non dui eu enim volutpat consectetur quis a enim. Suspendisse dictum nisl sit amet urna finibus, vitae gravida elit vestibulum. Nullam condimentum lorem porttitor quam tincidunt, eu congue diam ornare. Sed sit amet facilisis odio."
Quisque maximus ipsum id.,cat 1.2.2,"Etiam viverra risus eget metus ornare egestas a vitae arcu. Class aptent taciti sociosqu ad litora torquent per conubia nostra, per inceptos himenaeos. Mauris sed sapien sed turpis tristique eleifend nec nec orci. In dapibus eleifend finibus. In non felis dui. Praesent vulputate tellus nec orci lobortis, non feugiat leo dapibus. Fusce maximus est nec mauris semper ultricies. Vestibulum felis diam, mattis sit amet metus non, convallis consectetur nunc. Praesent diam dui, imperdiet nec dolor sit amet, dignissim eleifend est. Pellentesque semper efficitur magna, ac accumsan elit euismod in. Etiam vestibulum lectus id massa posuere scelerisque. Donec vulputate fringilla velit, vitae pharetra libero ultricies non. Pellentesque lacinia viverra auctor. Pellentesque rutrum ut sem vel dapibus."
Donec varius molestie nisi.,cat 2.1,"Etiam vehicula augue laoreet mi pharetra, nec ultrices leo tincidunt. Aenean nunc turpis, rhoncus et augue eget, tristique rutrum augue. Proin sodales sapien a tempor rutrum. Quisque ut neque vitae massa dapibus dignissim. Vivamus cursus tristique leo nec elementum. Maecenas orci erat, consequat in convallis ac, pharetra ac dolor. Etiam quis tempus dolor. Aliquam nec magna nibh. Mauris ac justo sit amet metus fermentum porttitor. Cras a odio ultrices nisi fringilla pellentesque. Cras condimentum ex ut sapien molestie, sed cursus lacus maximus. Duis sed ante finibus, placerat sem et, cursus sapien. Donec lectus enim, pellentesque ut dolor sed, ullamcorper mattis sem. Vivamus bibendum justo ac purus varius, ac rutrum orci tempor. Praesent ligula nisi, euismod sed tempus vel, ultrices vitae dolor."
"Fusce felis tortor, eleifend.",cat 3,"Fusce luctus pharetra augue, nec tincidunt ante blandit at. Integer quis sem quam. Morbi condimentum nisl ac nibh fermentum volutpat. Quisque non lacinia nunc. Donec quis mollis sapien, in volutpat tellus. Nulla justo arcu, ullamcorper nec tortor et, viverra laoreet leo. Suspendisse ipsum sapien, pharetra sit amet sem vel, luctus posuere turpis. Praesent sollicitudin, erat nec scelerisque dignissim, leo metus ultricies nunc, vel volutpat nunc diam eu est. Maecenas tincidunt diam feugiat nunc fringilla mattis. Nam et metus porta, cursus turpis eu, consequat lacus. Cras elementum turpis vitae magna viverra auctor. Phasellus tempus ac odio sit amet feugiat. Praesent pharetra sagittis tellus, a tempus nibh finibus commodo. In lacus urna, porttitor ac faucibus quis, finibus at erat. Vestibulum hendrerit blandit ante, quis ultrices augue efficitur sit amet. Morbi ac malesuada nisi, vel finibus metus."
"Vivamus posuere, urna id.",cat 1.2.2,"Praesent hendrerit at est at tempus. Phasellus leo turpis, mollis quis dolor a, vulputate iaculis leo. Quisque dapibus tellus sed metus viverra, sit amet ultrices dolor condimentum. Nullam a tristique dolor. Ut et ante diam. Cras dolor mauris, interdum et ornare quis, gravida sed felis. In ornare est vel mi dignissim ornare. Proin pellentesque ex at nulla congue, eget finibus orci laoreet. Curabitur varius tortor tellus, id luctus urna hendrerit nec. Nullam venenatis dolor nunc, sit amet elementum ligula auctor in. Curabitur est lectus, dictum lobortis gravida at, facilisis ut erat. Sed semper tortor sed sem fermentum consectetur. Proin leo risus, porttitor vel mi aliquam, facilisis volutpat nisi. Nulla in magna at nisl dignissim pretium. Cras aliquet imperdiet venenatis. Donec vel placerat dui."
Vivamus interdum efficitur elementum.,cat 2.1,"Sed faucibus vitae massa vel efficitur. In venenatis laoreet mauris eget scelerisque. Nam vehicula vulputate urna ac faucibus. Mauris eget neque vehicula, semper ante id, maximus velit. Donec vehicula nibh a dolor viverra, non sodales elit aliquam. Etiam sodales maximus volutpat. Maecenas libero augue, malesuada id felis et, ultrices aliquam ante. Aenean pulvinar aliquam sapien eget aliquam. Donec gravida lacus diam, at suscipit turpis varius at. Nullam porttitor dolor leo, quis malesuada mi finibus id."
Suspendisse auctor tincidunt leo.,cat 1.2.1,"Phasellus facilisis tincidunt leo. In aliquam arcu mauris, sed convallis tellus ultricies sed. Vestibulum ante ipsum primis in faucibus orci luctus et ultrices posuere cubilia curae; Cras ac urna ut metus elementum volutpat. Cras placerat neque quis leo mollis, et hendrerit diam cursus. Donec rhoncus, nulla eget tempor malesuada, sem massa scelerisque mi, in viverra sapien diam congue nibh. Cras et justo maximus, accumsan nulla vitae, ultricies elit. Pellentesque aliquet, elit sed lobortis pellentesque, lectus libero ullamcorper diam, in hendrerit dolor ante ac sem. Nulla quam urna, rhoncus a dolor a, condimentum ornare enim. Orci varius natoque penatibus et magnis dis parturient montes, nascetur ridiculus mus. Morbi vehicula ligula non cursus tempus. Aenean elementum erat dignissim mi tincidunt, ullamcorper interdum lacus accumsan. Mauris quis ante id arcu rutrum finibus at eu nisl. Mauris tristique urna et tellus tempor maximus. Pellentesque justo ex, blandit ac semper quis, hendrerit ut quam."