name,description,parent
cat 1.1,"Nulla facilisi. Aliquam sed nunc id ipsum luctus vulputate at sed turpis. Nullam faucibus tellus accumsan, aliquam tellus eget, venenatis.",cat 1
cat 1.2.1,"Lorem ipsum dolor sit amet, consectetur adipisici elit, sed eiusmod tempor incidunt ut labore et dolore magna aliqua.",cat 1.2
cat 1.2.2,"Aenean malesuada sem ut orci volutpat consectetur. Praesent feugiat, sapien at venenatis aliquet, lorem risus elementum nisl, sed bibendum nunc.",cat 1.2
cat 1.2,"Suspendisse sed lectus ultricies, condimentum orci eget, luctus orci. Quisque eget turpis id nisl facilisis luctus. Aenean sit amet tempus.",cat 1
cat 1,"Morbi cursus augue vel lorem ullamcorper, ut dictum magna hendrerit. Nullam nec sem a tellus imperdiet accumsan. Quisque lacinia odio.",
cat 2,"In hac habitasse platea dictumst. Sed ac purus ac quam ullamcorper vulputate. Praesent erat augue, tempor in dolor in, blandit.",
cat 2.1,Aliquam ornare id lacus eu volutpat. Duis et tortor quis odio semper facilisis. Ut eu posuere diam. Cras eu ante.,cat 2
cat 2.2,"Suspendisse potenti. Nullam in risus at eros mattis commodo a nec odio. Donec vel sollicitudin nulla, ac tincidunt mi. Pellentesque.",cat 2
cat 3,"Nulla id mauris a quam cursus consectetur in at diam. Nunc facilisis eget nunc vel fermentum. Nunc porttitor, turpis quis.",